{
  "$schema": "./schemas/graphql-query-catalog.schema.json",
  "schemaVersion": "1.0.0",
  "generatedAt": "2026-09-25T17:15:50.294Z",
  "targetApiVersion": "2026-03-10",
  "summary": {
    "totalPlannedCollectors": 237,
    "satisfiedByGraphQL": 35,
    "restOnly": 202,
    "consolidationRatio": "35 collectors consolidated into 4 GraphQL queries (>85% request volume reduction)"
  },
  "queries": [
    {
      "id": "graphql.org.metadata-deep",
      "purpose": "Consolidated organization profile, membership counts, security managers, and project fields",
      "targetScope": "organization",
      "satisfiedCollectorIds": [
        "rest.orgs.get",
        "rest.orgs.list-members",
        "rest.orgs.list-outside-collaborators",
        "rest.orgs.get-membership-for-user",
        "rest.orgs.list-security-manager-teams",
        "rest.projects.list-for-org",
        "rest.projects.list-fields-for-org"
      ],
      "queryText": "query OrgMetadataDeep($login: String!) {\n  rateLimit { cost remaining resetAt }\n  organization(login: $login) {\n    id\n    login\n    name\n    description\n    websiteUrl\n    isVerified\n    requiresTwoFactorAuthentication\n    defaultRepositoryPermission\n    membersWithRole { totalCount }\n    pendingMembers { totalCount }\n    securityManagers(first: 20) {\n      nodes { slug name }\n    }\n    projectsV2(first: 20) {\n      nodes {\n        id\n        title\n        fields(first: 20) {\n          nodes {\n            ... on ProjectV2FieldCommon { id name dataType }\n          }\n        }\n      }\n    }\n  }\n}",
      "variables": {
        "login": "String!"
      },
      "pageSize": 1,
      "estimatedPointCost": 2,
      "fieldMappings": {
        "id": "organization.id",
        "login": "organization.login",
        "name": "organization.displayName",
        "defaultRepositoryPermission": "organization.defaultRepositoryPermission",
        "securityManagers": "Entity[kind=policy]"
      }
    },
    {
      "id": "graphql.org.repositories-deep",
      "purpose": "Paged repository discovery with nested branch protections, repo rulesets, languages, release assets, and topics",
      "targetScope": "organization",
      "satisfiedCollectorIds": [
        "rest.repos.list-for-org",
        "rest.repos.get",
        "rest.repos.list-branches",
        "rest.repos.get-branch-protection",
        "rest.repos.get-branch-rules",
        "rest.repos.get-status-checks-protection",
        "rest.repos.get-repo-rulesets",
        "rest.repos.get-repo-ruleset",
        "rest.repos.list-languages",
        "rest.repos.list-forks",
        "rest.repos.get-all-topics",
        "rest.repos.list-release-assets",
        "rest.packages.list-packages-for-organization",
        "rest.packages.get-package-for-organization"
      ],
      "queryText": "query OrgRepositoriesDeep($login: String!, $cursor: String) {\n  rateLimit { cost remaining resetAt }\n  organization(login: $login) {\n    repositories(first: 100, after: $cursor, orderBy: {field: NAME, direction: ASC}) {\n      pageInfo { hasNextPage endCursor }\n      totalCount\n      nodes {\n        id\n        name\n        visibility\n        isArchived\n        isFork\n        diskUsage\n        defaultBranchRef { name }\n        refs(refPrefix: \"refs/heads/\", first: 20) {\n          nodes { name prefix }\n        }\n        branchProtectionRules(first: 10) {\n          nodes {\n            pattern\n            requiresApprovingReviews\n            requiredApprovingReviewCount\n            requiresStatusChecks\n            requiresStrictStatusChecks\n            requiredStatusCheckContexts\n          }\n        }\n        rulesets(first: 10) {\n          nodes {\n            name\n            enforcement\n            target\n          }\n        }\n        languages(first: 10, orderBy: {field: SIZE, direction: DESC}) {\n          edges { size node { name } }\n        }\n        repositoryTopics(first: 10) {\n          nodes { topic { name } }\n        }\n        releases(first: 5) {\n          nodes {\n            name\n            releaseAssets(first: 10) {\n              nodes { name size downloadCount }\n            }\n          }\n        }\n        packages(first: 10) {\n          nodes { name packageType }\n        }\n      }\n    }\n  }\n}",
      "variables": {
        "login": "String!",
        "cursor": "String"
      },
      "pageSize": 100,
      "estimatedPointCost": 5,
      "fieldMappings": {
        "id": "Entity[kind=repository].id",
        "name": "Entity[kind=repository].name",
        "visibility": "Entity[kind=repository].visibility",
        "diskUsage": "Entity[kind=repository].size (bytes = diskUsage * 1024)",
        "defaultBranchRef.name": "Entity[kind=repository].defaultBranch",
        "branchProtectionRules.nodes": "Entity[kind=policy]",
        "rulesets.nodes": "Entity[kind=policy]",
        "releaseAssets.nodes": "Entity[kind=asset]"
      }
    },
    {
      "id": "graphql.org.teams-deep",
      "purpose": "Team hierarchy, parent/child team linkages, members count, and repository permissions",
      "targetScope": "organization",
      "satisfiedCollectorIds": [
        "rest.teams.list",
        "rest.teams.get-by-name",
        "rest.teams.list-child-in-org",
        "rest.teams.list-members-in-org",
        "rest.teams.list-repos-in-org",
        "rest.repos.list-teams",
        "rest.repos.list-collaborators",
        "rest.repos.get-collaborator-permission-level"
      ],
      "queryText": "query OrgTeamsDeep($login: String!, $cursor: String) {\n  rateLimit { cost remaining resetAt }\n  organization(login: $login) {\n    teams(first: 100, after: $cursor, rootTeamsOnly: true) {\n      pageInfo { hasNextPage endCursor }\n      totalCount\n      nodes {\n        id\n        slug\n        name\n        description\n        members { totalCount }\n        childTeams(first: 20) {\n          nodes { id slug name members { totalCount } }\n        }\n        repositories(first: 100) {\n          edges {\n            permission\n            node { id name }\n          }\n        }\n      }\n    }\n  }\n}",
      "variables": {
        "login": "String!",
        "cursor": "String"
      },
      "pageSize": 100,
      "estimatedPointCost": 4,
      "fieldMappings": {
        "slug": "Entity[kind=team].name",
        "childTeams": "Entity[kind=team].parentTeamId",
        "members.totalCount": "Entity[kind=team].membershipCount",
        "repositories.edges": "Entity[kind=team].repositoryAccess"
      }
    },
    {
      "id": "graphql.enterprise.orgs-deep",
      "purpose": "Enterprise member organizations, license counts, enterprise teams, and assignments",
      "targetScope": "enterprise",
      "satisfiedCollectorIds": [
        "rest.enterprise-admin.get-consumed-licenses",
        "rest.enterprise-teams.list",
        "rest.enterprise-team-memberships.list",
        "rest.enterprise-team-memberships.get",
        "rest.enterprise-team-organizations.get-assignments",
        "rest.enterprise-team-organizations.get-assignment"
      ],
      "queryText": "query EnterpriseOrgsDeep($slug: String!, $cursor: String) {\n  rateLimit { cost remaining resetAt }\n  enterprise(slug: $slug) {\n    id\n    name\n    slug\n    organizations(first: 100, after: $cursor) {\n      pageInfo { hasNextPage endCursor }\n      totalCount\n      nodes { id login name }\n    }\n    teams(first: 50) {\n      nodes {\n        slug\n        name\n        members { totalCount }\n      }\n    }\n  }\n}",
      "variables": {
        "slug": "String!",
        "cursor": "String"
      },
      "pageSize": 100,
      "estimatedPointCost": 3,
      "fieldMappings": {
        "organizations.nodes": "DiscoveryBundle.organizations",
        "teams.nodes": "Entity[kind=team]"
      }
    }
  ],
  "restOnlyCollectors": [
    {
      "id": "rest.actions.get-actions-cache-retention-limit-for-enterprise",
      "module": "actions",
      "reason": "GitHub Actions runner infrastructure, runner groups, runner machine specs, custom runner images, and cache limits are REST-only",
      "requiredScope": "enterprise"
    },
    {
      "id": "rest.actions.get-actions-cache-storage-limit-for-enterprise",
      "module": "actions",
      "reason": "GitHub Actions runner infrastructure, runner groups, runner machine specs, custom runner images, and cache limits are REST-only",
      "requiredScope": "enterprise"
    },
    {
      "id": "rest.actions.get-actions-cache-usage-for-enterprise",
      "module": "actions",
      "reason": "GitHub Actions runner infrastructure, runner groups, runner machine specs, custom runner images, and cache limits are REST-only",
      "requiredScope": "enterprise"
    },
    {
      "id": "rest.actions.list-hosted-runners-for-enterprise",
      "module": "actions",
      "reason": "GitHub Actions runner infrastructure, runner groups, runner machine specs, custom runner images, and cache limits are REST-only",
      "requiredScope": "enterprise"
    },
    {
      "id": "rest.actions.list-custom-images-for-enterprise",
      "module": "actions",
      "reason": "GitHub Actions runner infrastructure, runner groups, runner machine specs, custom runner images, and cache limits are REST-only",
      "requiredScope": "enterprise"
    },
    {
      "id": "rest.actions.get-custom-image-for-enterprise",
      "module": "actions",
      "reason": "GitHub Actions runner infrastructure, runner groups, runner machine specs, custom runner images, and cache limits are REST-only",
      "requiredScope": "enterprise"
    },
    {
      "id": "rest.actions.list-custom-image-versions-for-enterprise",
      "module": "actions",
      "reason": "GitHub Actions runner infrastructure, runner groups, runner machine specs, custom runner images, and cache limits are REST-only",
      "requiredScope": "enterprise"
    },
    {
      "id": "rest.actions.get-custom-image-version-for-enterprise",
      "module": "actions",